{
  "agent_id": "agentreg:example.org:agent-123",
  "registration": "active",
  "operation": "restricted",
  "authority": "valid",
  "assurance": "conditional",
  "security": "elevated_monitoring",
  "effective_at": "2026-07-15T10:00:00Z",
  "observed_at": "2026-07-15T10:00:05Z",
  "valid_until": "2026-07-15T10:05:05Z",
  "restrictions": ["no_transaction_submission"],
  "source": "registry:example.org",
  "appeal_available": true,
  "proof": {}
}
